{
  "id": "person:puller-lewis",
  "name": "Lewis B. Puller",
  "sortName": "Puller, Lewis B.",
  "born": "1898-06-26",
  "died": "1971-10-11",
  "nationality": "US",
  "roles": [
    {
      "title": "Commanding Officer, 1st Battalion, 7th Marines",
      "from": "1942-09",
      "to": "1943-01"
    },
    {
      "title": "Executive Officer, 7th Marines (Cape Gloucester)",
      "from": "1943-12",
      "to": "1944-02"
    },
    { "title": "Commanding Officer, 1st Marines (Peleliu)", "from": "1944-09", "to": "1944-10" }
  ],
  "summary": "Battalion commander whose reputation was made on the night of 24–25 October 1942, when 1st Battalion, 7th Marines held about a thousand yards of the Guadalcanal perimeter against repeated regimental attacks by the Sendai Division and did not give way. Five Navy Crosses across three wars, the most awarded to any Marine, and the Corps' most quoted officer — which makes him a useful test of the difference between what a man did and what was later said about him.",
  "sources": [
    { "source": "source:frank-1990" },
    { "source": "source:sledge-1981" },
    { "source": "source:wikipedia-en", "note": "dates and dates of office" }
  ]
}
